{
  "$schema": "https://json-schema.org/draft/2020-12/schema",
  "$id": "https://hermes-auto-router.dev/schema/routing/route-decision.v1.json",
  "title": "RouteDecision explainability record (v1)",
  "description": "The explainability record every route produces (design.md §12). It is derived only from router inputs, router scores, and router policy. It is never derived from hidden model reasoning, and the router must not expose or attempt to generate such reasoning. The record deliberately cannot round-trip the request: it carries no prompt text, no message content, no tool arguments, no tool results, and no credential values — only identifiers, numeric scores, and machine-readable reason codes. Session identity appears only as a locally salted hash (ADR-0004, design.md §13.1). `selected` is not constrained to equal `ranked[0].candidate`, because a health veto (design.md §7.10) legitimately selects a lower-ranked candidate, and `ranked` may be empty when every candidate was hard-excluded, in which case `excluded` carries the explanation and `selected` is null.",
  "type": "object",
  "required": [
    "decision_id",
    "root_session_hash",
    "lane_id",
    "cache_epoch",
    "turn_id",
    "mode",
    "requirements",
    "excluded",
    "ranked",
    "selected",
    "reason_codes"
  ],
  "additionalProperties": false,
  "properties": {
    "decision_id": {
      "type": "string",
      "pattern": "^dec_",
      "minLength": 5,
      "description": "Opaque decision identifier, prefixed `dec_` (design.md §12)."
    },
    "root_session_hash": {
      "type": "string",
      "minLength": 1,
      "description": "The root session identifier hashed with a local salt — never the raw Hermes session id (ADR-0004, design.md §13.1). The salt is local, so this value is not correlatable across machines."
    },
    "lane_id": {
      "type": "string",
      "minLength": 1,
      "description": "Opaque lane identifier within the root session (design.md §6.2, ADR-0002)."
    },
    "cache_epoch": {
      "type": "integer",
      "minimum": 0,
      "description": "Cache epoch of the lane at decision time (design.md §6.4)."
    },
    "turn_id": {
      "type": "integer",
      "minimum": 0,
      "description": "User turn ordinal within the lane (design.md §6.3)."
    },
    "mode": {
      "type": "string",
      "enum": ["quality", "balanced", "economy", "session"],
      "description": "The routing mode in force for this decision (design.md §4.1)."
    },
    "requirements": {
      "type": "object",
      "description": "The predicted capability requirement vector (design.md §7.2). Properties are the eight capability dimensions, each normalized to [0, 1]. None are required: a heuristic predictor may legitimately emit only the subset of dimensions the request exercises, exactly as the design.md §12 example does. Unknown dimension names fail validation so a typo cannot silently vanish.",
      "additionalProperties": false,
      "properties": {
        "reasoning": { "type": "number", "minimum": 0, "maximum": 1 },
        "code_generation": { "type": "number", "minimum": 0, "maximum": 1 },
        "debugging": { "type": "number", "minimum": 0, "maximum": 1 },
        "tool_orchestration": { "type": "number", "minimum": 0, "maximum": 1 },
        "long_horizon_execution": { "type": "number", "minimum": 0, "maximum": 1 },
        "context_synthesis": { "type": "number", "minimum": 0, "maximum": 1 },
        "structured_precision": { "type": "number", "minimum": 0, "maximum": 1 },
        "multimodal_reasoning": { "type": "number", "minimum": 0, "maximum": 1 }
      }
    },
    "excluded": {
      "type": "array",
      "description": "Candidates removed by hard eligibility filters, policy, or veto (design.md §7.3, §7.10). Every entry carries at least one machine-readable reason, so no exclusion is ever unexplained. May be empty when nothing was excluded.",
      "items": {
        "type": "object",
        "required": ["candidate", "reasons"],
        "additionalProperties": false,
        "properties": {
          "candidate": {
            "type": "string",
            "minLength": 1,
            "description": "The `id` of the excluded candidate's model card."
          },
          "reasons": {
            "type": "array",
            "minItems": 1,
            "description": "Non-empty list of exclusion reasons. Each is a router-authored diagnostic string derived from limits, policy, or health — never from request content.",
            "items": { "type": "string", "minLength": 1 }
          }
        }
      }
    },
    "ranked": {
      "type": "array",
      "description": "Hard-eligible candidates ordered by final route loss, best first (design.md §7.8). May be empty when every candidate was hard-excluded; `excluded` then explains why and `selected` is null.",
      "items": {
        "type": "object",
        "required": ["candidate", "shortfall", "final_loss"],
        "additionalProperties": false,
        "properties": {
          "candidate": {
            "type": "string",
            "minLength": 1,
            "description": "The `id` of the ranked candidate's model card."
          },
          "shortfall": {
            "type": "number",
            "minimum": 0,
            "description": "Weighted capability shortfall (design.md §7.4). Bounded below at 0 but deliberately unbounded above, because it is a sum of positive per-dimension deficits across weighted dimensions and can exceed 1."
          },
          "final_loss": {
            "type": "number",
            "description": "Final route loss used for ordering (design.md §7.8). Unbounded in both directions: penalties and bonuses may drive it negative."
          },
          "estimated_cost": {
            "type": ["number", "null"],
            "minimum": 0,
            "description": "Estimated turn cost in USD (design.md §7.5). Null when the candidate's pricing is unknown — unknown is never treated as zero."
          },
          "estimated_ttft_ms": {
            "type": ["integer", "null"],
            "minimum": 0,
            "description": "Estimated time to first token in milliseconds (design.md §7.6). Null when no estimate is available."
          },
          "health": {
            "type": "number",
            "minimum": 0,
            "maximum": 1,
            "description": "Live health score at decision time (design.md §11.1)."
          },
          "switch_penalty": {
            "type": "number",
            "minimum": 0,
            "description": "Stickiness and hysteresis penalty applied for switching away from the incumbent (design.md §7.9)."
          }
        }
      }
    },
    "selected": {
      "type": ["string", "null"],
      "description": "The `id` of the selected candidate, or null for a structured failure in which no hard-eligible candidate remained. Deliberately NOT constrained to equal `ranked[0].candidate`: a health veto (design.md §7.10) selects a lower-ranked candidate and must remain representable."
    },
    "reason_codes": {
      "type": "array",
      "description": "Machine-readable reason codes for this decision, drawn from the frozen twelve-code vocabulary in design.md §12. The enum is exactly twelve values; it is a frozen contract and must not be widened without a schema version bump.",
      "items": {
        "type": "string",
        "enum": [
          "HARD_REQUIREMENT",
          "CAPABILITY_FIT",
          "DOMAIN_AFFINITY",
          "COST_TIEBREAK",
          "LATENCY_TIEBREAK",
          "STICKY_CACHE",
          "SWITCH_HYSTERESIS",
          "USER_PIN",
          "HEALTH_VETO",
          "PROVIDER_FALLBACK",
          "CONTEXT_ANCHOR",
          "EMERGENCY_DEFAULT"
        ]
      }
    },
    "model_card_version": {
      "type": "string",
      "minLength": 1,
      "description": "The model-card snapshot version this decision was scored against, taken from the card `evidence.source_version` (ADR-0003, design.md §9.2). Present so a decision is replayable against the exact card set that produced it."
    },
    "router_version": {
      "type": "string",
      "minLength": 1,
      "description": "Version of the router that produced this decision, so a behavioral change can be attributed to a specific release."
    }
  }
}
