{
  "decision_id": "dec_test0000000001",
  "root_session_hash": "03b276acf8d3c14651148e5f1ab6707c9844bd33694a476c3c8748dc0481737e",
  "lane_id": "lane_test_main",
  "cache_epoch": 4,
  "turn_id": 12,
  "mode": "balanced",
  "requirements": {
    "reasoning": 0.78,
    "code_generation": 0.65,
    "debugging": 0.91,
    "tool_orchestration": 0.73
  },
  "excluded": [
    {
      "candidate": "test-local-fast",
      "reasons": [
        "context window 65536 < required 84211"
      ]
    }
  ],
  "ranked": [
    {
      "candidate": "test-hosted-general",
      "shortfall": 0.01,
      "estimated_cost": 0.094,
      "estimated_ttft_ms": 540,
      "health": 0.12,
      "switch_penalty": 0.0,
      "final_loss": 0.18
    },
    {
      "candidate": "test-coding-specialist",
      "shortfall": 0.03,
      "estimated_cost": 0.071,
      "estimated_ttft_ms": 620,
      "health": 0.97,
      "switch_penalty": 0.14,
      "final_loss": 0.21
    }
  ],
  "selected": "test-coding-specialist",
  "reason_codes": [
    "CAPABILITY_FIT",
    "DOMAIN_AFFINITY",
    "COST_TIEBREAK"
  ],
  "model_card_version": "2026-07-26",
  "router_version": "0.1.0"
}
